{
  "proposed_action": "Merge PR https://example.invalid/pr/7",
  "head_sha": "3f8a1c2e9b7d4f60a1b2c3d4e5f60718293a4b5c",
  "base_sha": "9c0d1e2f3a4b5c6d7e8f90a1b2c3d4e5f6a7b8c9",
  "main_sha": "9c0d1e2f3a4b5c6d7e8f90a1b2c3d4e5f6a7b8c9",
  "outcome": "User finds published entries by title",
  "acceptance_criteria": [
    "4/4 AC PASS on head"
  ],
  "risk": {
    "level": "Medium",
    "accepted_residual_risks": [
      "Search ranking unchanged"
    ]
  },
  "ci_evidence": [
    "validate PASS on head",
    "e2e PASS on head"
  ],
  "review_evidence": [
    "Independent review READY on head, 0 blocking findings"
  ],
  "docs_impact": "Catalogue behavior documentation updated",
  "spec_conflicts": [],
  "collisions": "none open",
  "merge_order": "no dependency",
  "rollback": "Revert the merge commit",
  "limitations": [
    "Not checked on tablet width"
  ],
  "decision_requested": "Authorize merge of this PR at the stated head"
}
